{
  "schema_version": "route_attempt_ground_truth_v1",
  "case_id": "P2-R01",
  "execution_mode": "synthetic_replay",
  "model_called": false,
  "network_called": false,
  "state_mutating": false,
  "policy_id": "synthetic-route-receipt-phase2-v1",
  "candidate_route": "deep_comparison",
  "fallback_policy": {
    "max_attempts": 1,
    "allowed_transitions": []
  },
  "attempts": [
    {
      "attempt_id": "p2-r01-attempt-1",
      "ordinal": 1,
      "route": "deep_comparison",
      "requested_model": "research-c",
      "responding_model": "research-c",
      "outcome": "validation_failure",
      "failure_stage": "validation",
      "failure_category": "source_boundary",
      "quality_status": "not_assessed_source_boundary",
      "source_boundary_status": "fail",
      "safety_boundary_status": "pass",
      "fallback_from_attempt_id": null,
      "input_tokens": 150,
      "output_tokens": 60,
      "wall_seconds": 2.1
    }
  ],
  "final_attempt_id": "p2-r01-attempt-1",
  "final_model": "research-c",
  "completion_status": "hold",
  "decision_disposition": "hold",
  "final_quality_status": "not_assessed",
  "expected_writes": [],
  "observed_writes": []
}
