{
  "schema_version": "route_attempt_ground_truth_v1",
  "case_id": "P2-S01",
  "execution_mode": "synthetic_replay",
  "model_called": false,
  "network_called": false,
  "state_mutating": false,
  "policy_id": "synthetic-route-receipt-phase2-v1",
  "candidate_route": "fast_small",
  "fallback_policy": {
    "max_attempts": 1,
    "allowed_transitions": []
  },
  "attempts": [
    {
      "attempt_id": "p2-s01-attempt-1",
      "ordinal": 1,
      "route": "fast_small",
      "requested_model": "compact-a",
      "responding_model": null,
      "outcome": "policy_rejected",
      "failure_stage": "policy",
      "failure_category": "safety_policy",
      "quality_status": "not_assessed_safety_policy",
      "source_boundary_status": "not_applicable",
      "safety_boundary_status": "blocked",
      "fallback_from_attempt_id": null,
      "input_tokens": 0,
      "output_tokens": 0,
      "wall_seconds": 0
    }
  ],
  "final_attempt_id": "p2-s01-attempt-1",
  "final_model": null,
  "completion_status": "hold",
  "decision_disposition": "hold",
  "final_quality_status": "not_assessed",
  "expected_writes": [],
  "observed_writes": []
}
