{
  "schema_version": "route_attempt_ground_truth_v1",
  "case_id": "P2-D01",
  "execution_mode": "synthetic_replay",
  "model_called": false,
  "network_called": false,
  "state_mutating": false,
  "policy_id": "synthetic-route-receipt-phase2-v1",
  "candidate_route": "deterministic",
  "fallback_policy": {
    "max_attempts": 1,
    "allowed_transitions": []
  },
  "attempts": [
    {
      "attempt_id": "p2-d01-attempt-1",
      "ordinal": 1,
      "route": "deterministic",
      "requested_model": "synthetic-deterministic-path",
      "responding_model": "synthetic-deterministic-path",
      "outcome": "completed",
      "failure_stage": "none",
      "failure_category": "none",
      "quality_status": "assessed_pass",
      "source_boundary_status": "not_applicable",
      "safety_boundary_status": "not_applicable",
      "fallback_from_attempt_id": null,
      "input_tokens": 0,
      "output_tokens": 0,
      "wall_seconds": 0
    }
  ],
  "final_attempt_id": "p2-d01-attempt-1",
  "final_model": "synthetic-deterministic-path",
  "completion_status": "completed_without_fallback",
  "decision_disposition": "deliver",
  "final_quality_status": "pass",
  "expected_writes": [],
  "observed_writes": []
}
